{"$id":"project-memory/v1/tool-config","$schema":"https://json-schema.org/draft/2020-12/schema","additionalProperties":false,"properties":{"adapters":{"items":{"additionalProperties":false,"properties":{"definition_id":{"format":"definition-id","type":"string"},"definition_version":{"format":"semantic-version","type":"string"},"kind":{"anyOf":[{"const":"agent","type":"string"},{"const":"runtime","type":"string"},{"const":"workflow","type":"string"}]},"target_path":{"format":"safe-relative-path","minLength":1,"type":"string"},"target_sha256":{"format":"sha256","type":"string"}},"required":["kind","definition_id","definition_version","target_path","target_sha256"],"type":"object"},"type":"array","uniqueItems":true},"catalog_lock":{"const":"docs/project-memory/catalog.lock.json","type":"string"},"commands":{"items":{"minLength":1,"pattern":"\\S","type":"string"},"type":"array","uniqueItems":true},"gates":{"items":{"additionalProperties":false,"properties":{"commands":{"items":{"minLength":1,"pattern":"\\S","type":"string"},"type":"array","uniqueItems":true},"id":{"minLength":1,"pattern":"\\S","type":"string"},"required_evidence":{"items":{"minLength":1,"pattern":"\\S","type":"string"},"type":"array","uniqueItems":true},"source_definition_ids":{"items":{"format":"definition-id","type":"string"},"type":"array","uniqueItems":true}},"required":["id","source_definition_ids","commands","required_evidence"],"type":"object"},"type":"array","uniqueItems":true},"hub":{"anyOf":[{"additionalProperties":false,"properties":{"kind":{"const":"local","type":"string"},"repository":{"const":".","type":"string"}},"required":["kind","repository"],"type":"object"},{"additionalProperties":false,"properties":{"kind":{"const":"satellite","type":"string"},"repository":{"minLength":1,"pattern":"^(?!-)(?![A-Za-z]:[\\\\/])(?!/)(?!file:)(?!.*[\\u0000\\r\\n])(?=.*\\S).+$","type":"string"}},"required":["kind","repository"],"type":"object"}]},"memory_root":{"const":"docs/project-memory","type":"string"},"policy":{"additionalProperties":false,"properties":{"archive_secret_scan":{"type":"boolean"},"generated_view_check":{"type":"boolean"},"require_clean_canonical_tree":{"type":"boolean"}},"required":["require_clean_canonical_tree","generated_view_check","archive_secret_scan"],"type":"object"},"profile_lock":{"const":"docs/project-memory/profile.lock.yaml","type":"string"},"root_id":{"pattern":"^ROOT-[0-9A-HJKMNP-TV-Z]{26}$","type":"string"},"schema_version":{"const":"1.0.0","type":"string"}},"required":["schema_version","root_id","memory_root","profile_lock","catalog_lock","hub","policy"],"type":"object"}
